<?xml version="1.0" encoding="UTF-8"?>
<!DOCTYPE compact-defs SYSTEM "../../../dtd/compact.dtd">
<compact-defs pubno="EM25T2E" ver="2.1.2.9">
    <part code="2" figID="1" type="rb">
        <path d="M 276.20, 27.71 L 326.34, 27.71 L 326.34, 103.77 L 276.20, 103.77 L 276.20, 27.71 "/>
    </part>
    <part code="2" figID="2" type="rb">
        <path d="M 106.23, 27.71 L 156.75, 27.71 L 156.75, 103.77 L 106.23, 103.77 L 106.23, 27.71 "/>
    </part>
    <part code="I105" figID="3" type="conn">
        <path d="M 101.42, 154.19 L 127.48, 154.19 L 127.48, 189.32 L 101.42, 189.32 L 101.42, 154.19 "/>
    </part>
    <part code="I107" figID="4" type="conn">
        <path d="M 65.34, 239.18 L 84.99, 239.18 L 84.99, 274.31 L 65.34, 274.31 L 65.34, 239.18 "/>
    </part>
    <part code="2" figID="5" type="rb">
        <path d="M 254.96, 239.75 L 388.81, 239.75 L 388.81, 350.23 L 254.96, 350.23 L 254.96, 239.75 "/>
    </part>
    <part code="L51,L55,L58" figID="6" type="conn">
        <path d="M 141.83, 408.02 L 181.19, 408.02 L 181.19, 479.41 L 141.83, 479.41 L 141.83, 408.02 "/>
    </part>
    <part code="L7" figID="7" split="h" type="conn">
        <path d="M 135.98, 518.20 L 280.45, 518.20 L 280.45, 564.69 L 135.98, 564.69 L 135.98, 518.20 "/>
        <conn lineID="10">
            <path d="M 257.35, 512.22 L 265.08, 512.22 L 265.08, 527.83 L 257.35, 527.83 L 257.35, 512.22 "/>
        </conn>
        <conn lineID="6">
            <path d="M 147.04, 554.70 L 154.54, 554.70 L 154.54, 570.96 L 147.04, 570.96 L 147.04, 554.70 "/>
        </conn>
        <conn lineID="7">
            <path d="M 147.04, 512.27 L 154.47, 512.27 L 154.47, 527.83 L 147.04, 527.83 L 147.04, 512.27 "/>
        </conn>
    </part>
    <part code="c1,c2" figID="8" type="conn">
        <path d="M 722.38, 264.67 L 739.38, 264.67 L 739.38, 316.80 L 722.38, 316.80 L 722.38, 264.67 "/>
    </part>
    <part code="d1,f1" figID="9" type="conn">
        <path d="M 807.36, 264.67 L 824.36, 264.67 L 824.36, 316.80 L 807.36, 316.80 L 807.36, 264.67 "/>
    </part>
    <part code="I94" figID="10" type="conn">
        <path d="M 373.94, 435.78 L 390.93, 435.78 L 390.93, 468.90 L 373.94, 468.90 L 373.94, 435.78 "/>
    </part>
    <part code="IL5" figID="14" type="w2w">
        <path d="M 140.58, 348.23 L 178.79, 348.23 L 178.79, 367.79 L 140.58, 367.79 L 140.58, 348.23 "/>
    </part>
    <part code="IL1" figID="15" type="w2w">
        <path d="M 140.59, 339.73 L 177.79, 339.73 L 177.79, 352.23 L 140.59, 352.23 L 140.59, 339.73 "/>
    </part>
    <part code="LI1" figID="16" type="w2w">
        <path d="M 248.37, 443.14 L 271.95, 443.14 L 271.95, 462.71 L 248.37, 462.71 L 248.37, 443.14 "/>
    </part>
    <part code="IS3" figID="17" type="w2w">
        <path d="M 367.35, 560.69 L 390.93, 560.69 L 390.93, 580.26 L 367.35, 580.26 L 367.35, 560.69 "/>
    </part>
    <part code="TS1" figID="18" type="w2w">
        <path d="M 591.00, 526.70 L 611.90, 526.70 L 611.90, 546.26 L 591.00, 546.26 L 591.00, 526.70 "/>
    </part>
    <part code="bT1" figID="19" type="w2w">
        <path d="M 591.42, 441.71 L 611.90, 441.71 L 611.90, 461.27 L 591.42, 461.27 L 591.42, 441.71 "/>
    </part>
    <part code="db1" figID="20" type="w2w">
        <path d="M 591.42, 382.22 L 611.90, 382.22 L 611.90, 401.78 L 591.42, 401.78 L 591.42, 382.22 "/>
    </part>
    <part code="aS2" figID="21" type="w2w">
        <path d="M 650.91, 441.71 L 671.39, 441.71 L 671.39, 461.27 L 650.91, 461.27 L 650.91, 441.71 "/>
    </part>
    <part code="ca3" figID="22" type="w2w">
        <path d="M 650.91, 382.22 L 671.39, 382.22 L 671.39, 401.78 L 650.91, 401.78 L 650.91, 382.22 "/>
    </part>
    <part code="TS1" figID="23" type="w2w">
        <path d="M 718.50, 519.63 L 739.38, 519.63 L 739.38, 539.20 L 718.50, 539.20 L 718.50, 519.63 "/>
    </part>
    <part code="aS2" figID="24" type="w2w">
        <path d="M 718.50, 441.71 L 739.38, 441.71 L 739.38, 461.27 L 718.50, 461.27 L 718.50, 441.71 "/>
    </part>
    <part code="ca4" figID="25" type="w2w">
        <path d="M 718.90, 382.22 L 739.38, 382.22 L 739.38, 401.78 L 718.90, 401.78 L 718.90, 382.22 "/>
    </part>
    <part code="bT1" figID="26" type="w2w">
        <path d="M 803.41, 484.20 L 824.36, 484.20 L 824.36, 503.77 L 803.41, 503.77 L 803.41, 484.20 "/>
    </part>
    <part code="bf1" figID="27" type="w2w">
        <path d="M 803.88, 375.16 L 824.36, 375.16 L 824.36, 394.72 L 803.88, 394.72 L 803.88, 375.16 "/>
    </part>
    <part code="LA" figID="28" type="gp">
        <path d="M 142.35, 679.67 L 163.60, 679.67 L 163.60, 710.00 L 142.35, 710.00 L 142.35, 679.67 "/>
    </part>
    <part code="TA" figID="29" type="gp">
        <path d="M 720.25, 679.67 L 741.50, 679.67 L 741.50, 710.00 L 720.25, 710.00 L 720.25, 679.67 "/>
    </part>
</compact-defs>
