<?xml version="1.0" encoding="UTF-8"?>
<!DOCTYPE compact-defs SYSTEM "../../../dtd/compact.dtd">
<compact-defs pubno="EM25T2E" ver="2.1.2.9">
    <part code="L24" figID="1" type="conn">
        <path d="M 59.49, 391.59 L 399.43, 391.59 L 399.43, 529.83 L 59.49, 529.83 L 59.49, 391.59 "/>
    </part>
    <part code="L53" figID="2" type="conn">
        <path d="M 283.02, 614.18 L 305.95, 614.18 L 305.95, 647.37 L 283.02, 647.37 L 283.02, 614.18 "/>
    </part>
    <part code="L25" figID="3" type="conn">
        <path d="M 824.36, 162.69 L 917.85, 162.69 L 917.85, 316.80 L 824.36, 316.80 L 824.36, 162.69 "/>
    </part>
    <part code="J1" figID="4" type="conn">
        <path d="M 594.79, 299.73 L 611.90, 299.73 L 611.90, 332.92 L 594.79, 332.92 L 594.79, 299.73 "/>
    </part>
    <part code="J2" figID="5" type="conn">
        <path d="M 671.27, 299.73 L 688.38, 299.73 L 688.38, 332.92 L 671.27, 332.92 L 671.27, 299.73 "/>
    </part>
    <part code="4" figID="6" type="rb">
        <path d="M 38.24, 27.71 L 84.66, 27.71 L 84.66, 103.77 L 38.24, 103.77 L 38.24, 27.71 "/>
    </part>
    <part code="2" figID="7" type="rb">
        <path d="M 182.72, 61.28 L 224.35, 61.28 L 224.35, 171.76 L 182.72, 171.76 L 182.72, 61.28 "/>
    </part>
    <part code="2" figID="8" type="rb">
        <path d="M 344.19, 27.71 L 395.65, 27.71 L 395.65, 103.77 L 344.19, 103.77 L 344.19, 27.71 "/>
    </part>
    <part code="2" figID="9" type="rb">
        <path d="M 322.95, 180.26 L 374.34, 180.26 L 374.34, 265.24 L 322.95, 265.24 L 322.95, 180.26 "/>
    </part>
    <part code="2" figID="10" type="rb">
        <path d="M 42.49, 222.75 L 99.88, 222.75 L 99.88, 307.73 L 42.49, 307.73 L 42.49, 222.75 "/>
    </part>
    <part code="I106" figID="11" type="conn">
        <path d="M 184.32, 213.68 L 203.97, 213.68 L 203.97, 248.81 L 184.32, 248.81 L 184.32, 213.68 "/>
    </part>
    <part code="IL6" figID="17" type="w2w">
        <path d="M 38.61, 348.23 L 76.80, 348.23 L 76.80, 367.79 L 38.61, 367.79 L 38.61, 348.23 "/>
    </part>
    <part code="IL2" figID="18" type="w2w">
        <path d="M 38.59, 339.73 L 75.80, 339.73 L 75.80, 352.23 L 38.59, 352.23 L 38.59, 339.73 "/>
    </part>
    <part code="AI1" figID="19" type="w2w">
        <path d="M 39.01, 127.26 L 59.49, 127.26 L 59.49, 146.83 L 39.01, 146.83 L 39.01, 127.26 "/>
    </part>
    <part code="IL5" figID="20" type="w2w">
        <path d="M 315.89, 348.23 L 357.26, 348.23 L 357.26, 367.79 L 315.89, 367.79 L 315.89, 348.23 "/>
    </part>
    <part code="IL1" figID="21" type="w2w">
        <path d="M 315.89, 339.73 L 356.26, 339.73 L 356.26, 352.23 L 315.89, 352.23 L 315.89, 339.73 "/>
    </part>
    <part code="IL5" figID="22" type="w2w">
        <path d="M 392.38, 246.24 L 433.74, 246.24 L 433.74, 258.74 L 392.38, 258.74 L 392.38, 246.24 "/>
    </part>
    <part code="IL1" figID="23" type="w2w">
        <path d="M 392.38, 230.68 L 432.74, 230.68 L 432.74, 250.24 L 392.38, 250.24 L 392.38, 230.68 "/>
    </part>
    <part code="KI2" figID="24" type="w2w">
        <path d="M 591.02, 475.71 L 611.90, 475.71 L 611.90, 495.27 L 591.02, 495.27 L 591.02, 475.71 "/>
    </part>
    <part code="JK2" figID="25" type="w2w">
        <path d="M 591.02, 399.22 L 611.90, 399.22 L 611.90, 418.78 L 591.02, 418.78 L 591.02, 399.22 "/>
    </part>
    <part code="JK2" figID="26" type="w2w">
        <path d="M 591.00, 247.68 L 611.90, 247.68 L 611.90, 267.24 L 591.00, 267.24 L 591.00, 247.68 "/>
    </part>
    <part code="KI2" figID="27" type="w2w">
        <path d="M 591.00, 188.19 L 611.90, 188.19 L 611.90, 207.75 L 591.00, 207.75 L 591.00, 188.19 "/>
    </part>
    <part code="KI2" figID="28" type="w2w">
        <path d="M 667.54, 475.71 L 688.38, 475.71 L 688.38, 495.27 L 667.54, 495.27 L 667.54, 475.71 "/>
    </part>
    <part code="JK2" figID="29" type="w2w">
        <path d="M 667.54, 399.22 L 688.38, 399.22 L 688.38, 418.78 L 667.54, 418.78 L 667.54, 399.22 "/>
    </part>
    <part code="JK2" figID="30" type="w2w">
        <path d="M 667.49, 247.68 L 688.38, 247.68 L 688.38, 267.24 L 667.49, 267.24 L 667.49, 247.68 "/>
    </part>
    <part code="KI2" figID="31" type="w2w">
        <path d="M 667.49, 188.19 L 688.38, 188.19 L 688.38, 207.75 L 667.49, 207.75 L 667.49, 188.19 "/>
    </part>
    <part code="CA4" figID="32" type="w2w">
        <path d="M 741.29, 536.63 L 764.87, 536.63 L 764.87, 556.19 L 741.29, 556.19 L 741.29, 536.63 "/>
    </part>
    <part code="AC1" figID="33" type="w2w">
        <path d="M 795.38, 543.69 L 815.86, 543.69 L 815.86, 563.26 L 795.38, 563.26 L 795.38, 543.69 "/>
    </part>
    <part code="AI3" figID="34" type="w2w">
        <path d="M 792.28, 484.20 L 829.19, 484.20 L 829.19, 496.70 L 792.28, 496.70 L 792.28, 484.20 "/>
    </part>
    <part code="AI3" figID="35" type="w2w">
        <path d="M 791.88, 475.71 L 829.19, 475.71 L 829.19, 488.20 L 791.88, 488.20 L 791.88, 475.71 "/>
    </part>
    <part code="AI3" figID="36" type="w2w">
        <path d="M 791.81, 467.21 L 825.85, 467.21 L 825.85, 479.71 L 791.81, 479.71 L 791.81, 467.21 "/>
    </part>
    <part code="AI3" figID="37" type="w2w">
        <path d="M 791.71, 451.64 L 825.85, 451.64 L 825.85, 471.21 L 791.71, 471.21 L 791.71, 451.64 "/>
    </part>
    <part code="AC5" figID="38" type="w2w">
        <path d="M 862.97, 552.19 L 893.83, 552.19 L 893.83, 571.76 L 862.97, 571.76 L 862.97, 552.19 "/>
    </part>
    <part code="IC2" figID="39" type="w2w">
        <path d="M 862.97, 543.69 L 893.83, 543.69 L 893.83, 556.19 L 862.97, 556.19 L 862.97, 543.69 "/>
    </part>
    <part code="IL6" figID="40" type="w2w">
        <path d="M 860.27, 356.73 L 901.16, 356.73 L 901.16, 369.22 L 860.27, 369.22 L 860.27, 356.73 "/>
    </part>
    <part code="IL2" figID="41" type="w2w">
        <path d="M 862.80, 341.16 L 900.16, 341.16 L 900.16, 360.73 L 862.80, 360.73 L 862.80, 341.16 "/>
    </part>
    <part code="AI3" figID="42" type="w2w">
        <path d="M 902.36, 451.64 L 926.35, 451.64 L 926.35, 471.21 L 902.36, 471.21 L 902.36, 451.64 "/>
    </part>
    <part code="LB" figID="43" type="gp">
        <path d="M 244.33, 679.67 L 265.58, 679.67 L 265.58, 710.00 L 244.33, 710.00 L 244.33, 679.67 "/>
    </part>
    <part code="LA" figID="44" type="gp">
        <path d="M 286.83, 679.67 L 308.07, 679.67 L 308.07, 710.00 L 286.83, 710.00 L 286.83, 679.67 "/>
    </part>
    <part code="IE" figID="45" type="gp">
        <path d="M 592.78, 679.67 L 614.02, 679.67 L 614.02, 710.00 L 592.78, 710.00 L 592.78, 679.67 "/>
    </part>
    <part code="IG" figID="46" type="gp">
        <path d="M 669.26, 679.67 L 690.51, 679.67 L 690.51, 710.00 L 669.26, 710.00 L 669.26, 679.67 "/>
    </part>
    <part code="CE" figID="47" type="gp">
        <path d="M 745.75, 679.67 L 767.00, 679.67 L 767.00, 710.00 L 745.75, 710.00 L 745.75, 679.67 "/>
    </part>
    <part code="CC" figID="48" type="gp">
        <path d="M 796.74, 679.67 L 817.99, 679.67 L 817.99, 710.00 L 796.74, 710.00 L 796.74, 679.67 "/>
    </part>
    <part code="CA" figID="49" type="gp">
        <path d="M 864.73, 679.67 L 885.98, 679.67 L 885.98, 710.00 L 864.73, 710.00 L 864.73, 679.67 "/>
    </part>
</compact-defs>
