<?xml version="1.0" encoding="UTF-8"?>
<!DOCTYPE compact-defs SYSTEM "../../../dtd/compact.dtd">
<compact-defs pubno="EM25T2E" ver="2.1.2.9">
    <part code="L25" figID="1" type="conn">
        <path d="M 875.35, 162.69 L 943.34, 162.69 L 943.34, 316.80 L 875.35, 316.80 L 875.35, 162.69 "/>
    </part>
    <part code="4" figID="2" type="rb">
        <path d="M 140.23, 27.71 L 186.64, 27.71 L 186.64, 103.77 L 140.23, 103.77 L 140.23, 27.71 "/>
    </part>
    <part code="2" figID="3" type="rb">
        <path d="M 284.70, 61.28 L 326.33, 61.28 L 326.33, 171.76 L 284.70, 171.76 L 284.70, 61.28 "/>
    </part>
    <part code="2" figID="4" type="rb">
        <path d="M 144.48, 231.25 L 201.87, 231.25 L 201.87, 316.23 L 144.48, 316.23 L 144.48, 231.25 "/>
    </part>
    <part code="T5" figID="5" type="conn">
        <path d="M 764.87, 477.14 L 824.36, 477.14 L 824.36, 546.26 L 764.87, 546.26 L 764.87, 477.14 "/>
    </part>
    <part code="2" figID="6" type="rb">
        <path d="M 637.39, 137.76 L 694.78, 137.76 L 694.78, 222.75 L 637.39, 222.75 L 637.39, 137.76 "/>
    </part>
    <part code="2" figID="7" type="rb">
        <path d="M 658.64, 27.71 L 710.77, 27.71 L 710.77, 103.77 L 658.64, 103.77 L 658.64, 27.71 "/>
    </part>
    <part code="L53" figID="8" type="conn">
        <path d="M 283.02, 614.18 L 305.95, 614.18 L 305.95, 647.37 L 283.02, 647.37 L 283.02, 614.18 "/>
    </part>
    <part code="L24" figID="9" type="conn">
        <path d="M 67.99, 400.65 L 399.43, 400.65 L 399.43, 520.76 L 67.99, 520.76 L 67.99, 400.65 "/>
    </part>
    <part code="T18" figID="10" split="h" type="conn">
        <path d="M 688.38, 492.70 L 722.38, 492.70 L 722.38, 530.70 L 688.38, 530.70 L 688.38, 492.70 "/>
        <conn lineID="21">
            <path d="M 699.38, 520.71 L 706.95, 520.71 L 706.95, 536.89 L 699.38, 536.89 L 699.38, 520.71 "/>
        </conn>
        <conn lineID="22">
            <path d="M 699.85, 486.70 L 706.87, 486.70 L 706.87, 502.34 L 699.85, 502.34 L 699.85, 486.70 "/>
        </conn>
    </part>
    <part code="IL2" figID="16" type="w2w">
        <path d="M 140.57, 348.23 L 161.47, 348.23 L 161.47, 367.79 L 140.57, 367.79 L 140.57, 348.23 "/>
    </part>
    <part code="AI1" figID="17" type="w2w">
        <path d="M 140.99, 127.26 L 161.47, 127.26 L 161.47, 146.83 L 140.99, 146.83 L 140.99, 127.26 "/>
    </part>
    <part code="LI1" figID="18" type="w2w">
        <path d="M 630.34, 273.17 L 654.39, 273.17 L 654.39, 292.74 L 630.34, 292.74 L 630.34, 273.17 "/>
    </part>
    <part code="ST3" figID="19" type="w2w">
        <path d="M 693.04, 407.72 L 713.88, 407.72 L 713.88, 427.28 L 693.04, 427.28 L 693.04, 407.72 "/>
    </part>
    <part code="TS2" figID="20" type="w2w">
        <path d="M 786.52, 341.16 L 807.37, 341.16 L 807.37, 360.73 L 786.52, 360.73 L 786.52, 341.16 "/>
    </part>
    <part code="IS3" figID="21" type="w2w">
        <path d="M 786.48, 288.74 L 807.37, 288.74 L 807.37, 308.30 L 786.48, 308.30 L 786.48, 288.74 "/>
    </part>
    <part code="LI1" figID="22" type="w2w">
        <path d="M 783.31, 186.75 L 807.37, 186.75 L 807.37, 206.32 L 783.31, 206.32 L 783.31, 186.75 "/>
    </part>
    <part code="AC1" figID="23" type="w2w">
        <path d="M 905.87, 535.20 L 926.35, 535.20 L 926.35, 554.76 L 905.87, 554.76 L 905.87, 535.20 "/>
    </part>
    <part code="AI3" figID="24" type="w2w">
        <path d="M 902.19, 468.64 L 926.35, 468.64 L 926.35, 488.20 L 902.19, 488.20 L 902.19, 468.64 "/>
    </part>
    <part code="IL2" figID="25" type="w2w">
        <path d="M 905.30, 341.16 L 926.35, 341.16 L 926.35, 360.73 L 905.30, 360.73 L 905.30, 341.16 "/>
    </part>
    <part code="IC2" figID="26" type="w2w">
        <path d="M 990.45, 535.20 L 1011.33, 535.20 L 1011.33, 554.76 L 990.45, 554.76 L 990.45, 535.20 "/>
    </part>
    <part code="LB" figID="27" type="gp">
        <path d="M 244.33, 679.67 L 265.58, 679.67 L 265.58, 710.00 L 244.33, 710.00 L 244.33, 679.67 "/>
    </part>
    <part code="LA" figID="28" type="gp">
        <path d="M 286.83, 679.67 L 308.07, 679.67 L 308.07, 710.00 L 286.83, 710.00 L 286.83, 679.67 "/>
    </part>
    <part code="TB" figID="29" type="gp">
        <path d="M 643.77, 679.67 L 665.01, 679.67 L 665.01, 710.00 L 643.77, 710.00 L 643.77, 679.67 "/>
    </part>
    <part code="TC" figID="30" type="gp">
        <path d="M 694.76, 679.67 L 716.01, 679.67 L 716.01, 710.00 L 694.76, 710.00 L 694.76, 679.67 "/>
    </part>
    <part code="TA" figID="31" type="gp">
        <path d="M 788.24, 679.67 L 809.49, 679.67 L 809.49, 710.00 L 788.24, 710.00 L 788.24, 679.67 "/>
    </part>
    <part code="CC" figID="32" type="gp">
        <path d="M 907.22, 679.67 L 928.47, 679.67 L 928.47, 710.00 L 907.22, 710.00 L 907.22, 679.67 "/>
    </part>
    <part code="CA" figID="33" type="gp">
        <path d="M 992.21, 679.67 L 1013.46, 679.67 L 1013.46, 710.00 L 992.21, 710.00 L 992.21, 679.67 "/>
    </part>
</compact-defs>
