<?xml version="1.0" encoding="UTF-8"?>
<!DOCTYPE compact-defs SYSTEM "../../../dtd/compact.dtd">
<compact-defs pubno="EM25T2E" ver="2.1.2.9">
    <part code="2" figID="1" type="rb">
        <path d="M 658.64, 27.71 L 700.16, 27.71 L 700.16, 103.77 L 658.64, 103.77 L 658.64, 27.71 "/>
    </part>
    <part code="I59,I70" figID="2" type="conn">
        <path d="M 660.24, 187.05 L 685.93, 187.05 L 685.93, 258.44 L 660.24, 258.44 L 660.24, 187.05 "/>
    </part>
    <part code="4" figID="3" type="rb">
        <path d="M 344.19, 27.71 L 385.38, 27.71 L 385.38, 103.77 L 344.19, 103.77 L 344.19, 27.71 "/>
    </part>
    <part code="1" figID="4" type="rb">
        <path d="M 348.44, 180.26 L 408.48, 180.26 L 408.48, 282.24 L 348.44, 282.24 L 348.44, 180.26 "/>
    </part>
    <part code="D10,E3" figID="5" type="conn">
        <path d="M 144.48, 222.18 L 178.47, 222.18 L 178.47, 299.80 L 144.48, 299.80 L 144.48, 222.18 "/>
    </part>
    <part code="E2,F2" figID="6" type="conn">
        <path d="M 50.99, 392.15 L 84.99, 392.15 L 84.99, 469.77 L 50.99, 469.77 L 50.99, 392.15 "/>
    </part>
    <part code="A36,D8,E1,E4,F1" figID="7" type="conn">
        <path d="M 127.48, 392.15 L 203.97, 392.15 L 203.97, 469.77 L 127.48, 469.77 L 127.48, 392.15 "/>
    </part>
    <part code="C89,D5" figID="8" split="h" type="conn">
        <path d="M 246.46, 399.22 L 322.95, 399.22 L 322.95, 437.21 L 246.46, 437.21 L 246.46, 399.22 "/>
        <conn lineID="7,8">
            <path d="M 255.41, 392.15 L 267.99, 392.15 L 267.99, 408.85 L 255.41, 408.85 L 255.41, 392.15 "/>
        </conn>
        <conn lineID="9">
            <path d="M 297.90, 392.15 L 310.48, 392.15 L 310.48, 408.92 L 297.90, 408.92 L 297.90, 392.15 "/>
        </conn>
    </part>
    <part code="A22" figID="9" type="conn">
        <path d="M 373.82, 528.13 L 396.98, 528.13 L 396.98, 581.39 L 373.82, 581.39 L 373.82, 528.13 "/>
    </part>
    <part code="A30" figID="10" type="conn">
        <path d="M 569.40, 434.65 L 603.40, 434.65 L 603.40, 479.71 L 569.40, 479.71 L 569.40, 434.65 "/>
    </part>
    <part code="AC1" figID="15" type="w2w">
        <path d="M 290.87, 339.73 L 314.45, 339.73 L 314.45, 359.29 L 290.87, 359.29 L 290.87, 339.73 "/>
    </part>
    <part code="AI3" figID="16" type="w2w">
        <path d="M 659.05, 307.17 L 679.89, 307.17 L 679.89, 326.73 L 659.05, 326.73 L 659.05, 307.17 "/>
    </part>
    <part code="FC" figID="17" type="gp">
        <path d="M 14.87, 679.67 L 36.12, 679.67 L 36.12, 710.00 L 14.87, 710.00 L 14.87, 679.67 "/>
    </part>
    <part code="FB" figID="18" type="gp">
        <path d="M 57.37, 679.67 L 78.61, 679.67 L 78.61, 710.00 L 57.37, 710.00 L 57.37, 679.67 "/>
    </part>
    <part code="AC" figID="19" type="gp">
        <path d="M 125.35, 679.67 L 146.60, 679.67 L 146.60, 710.00 L 125.35, 710.00 L 125.35, 679.67 "/>
    </part>
    <part code="FA" figID="20" type="gp">
        <path d="M 176.35, 679.67 L 197.59, 679.67 L 197.59, 710.00 L 176.35, 710.00 L 176.35, 679.67 "/>
    </part>
    <part code="AA" figID="21" type="gp">
        <path d="M 371.81, 679.67 L 393.06, 679.67 L 393.06, 710.00 L 371.81, 710.00 L 371.81, 679.67 "/>
    </part>
    <part code=" " figID="14" type="annex">
        <path d="M 297.45, 433.21 L 314.45, 433.21 L 314.45, 457.04 L 297.45, 457.04 L 297.45, 433.21 "/>
    </part>
</compact-defs>
